{
  "schemaVersion": 1,
  "locale": "hi-Latn-IN",
  "version": "2026.08.06.1",
  "fallbacks": ["en-IN"],
  "ui": {
    "languageName": "Hinglish (Latin)",
    "addItem": "Item jodein",
    "sortBy": "Kram",
    "latestAdded": "Sabse naya",
    "oldestAdded": "Sabse purana",
    "itemNameAscending": "Naam A–Z",
    "needsAttentionFirst": "Dhyan wale pehle"
  },
  "items": [
    { "id": "grocery.bread.loaf", "primary": "bread", "aliases": ["double roti", "loaf"] },
    { "id": "grocery.butter.dairy", "primary": "butter", "aliases": ["dairy butter"] },
    { "id": "grocery.biscuits.plain", "primary": "biscuit", "aliases": ["biscuits"] },
    { "id": "grocery.eggs.chicken", "primary": "ande", "aliases": ["anda", "egg", "eggs"] },
    { "id": "grocery.flour.wheat", "primary": "atta", "aliases": ["aata", "gehun atta", "wheat flour"] },
    { "id": "grocery.milk.dairy", "primary": "doodh", "aliases": ["milk"] },
    { "id": "grocery.noodles", "primary": "noodles", "aliases": ["noodle"] },
    { "id": "grocery.onion", "primary": "pyaaz", "aliases": ["onion", "pyaz"] },
    { "id": "grocery.potato", "primary": "aloo", "aliases": ["potato", "potatoes"] },
    { "id": "grocery.rice.white", "primary": "chawal", "aliases": ["rice", "safed chawal"] },
    { "id": "grocery.sugar.white", "primary": "cheeni", "aliases": ["chini", "sugar"] },
    { "id": "grocery.tea", "primary": "chai", "aliases": ["tea"] },
    { "id": "grocery.tomato", "primary": "tamatar", "aliases": ["tomato", "tomatoes"] }
  ],
  "units": [
    { "id": "bag", "primary": "bag", "aliases": ["bags"] },
    { "id": "bottle", "primary": "bottle", "aliases": ["bottles"] },
    { "id": "box", "primary": "box", "aliases": ["boxes"] },
    { "id": "can", "primary": "can", "aliases": ["cans"] },
    { "id": "carton", "primary": "carton", "aliases": ["cartons"] },
    { "id": "dozen", "primary": "dozen", "aliases": ["dozens"] },
    { "id": "g", "primary": "g", "aliases": ["gm", "gms", "gram", "grams"] },
    { "id": "kg", "primary": "kg", "aliases": ["kgs", "kilo", "kilos", "kilogram", "kilograms"] },
    { "id": "l", "primary": "l", "aliases": ["liter", "liters", "litre", "litres"] },
    { "id": "ml", "primary": "ml", "aliases": ["milliliter", "milliliters", "millilitre", "millilitres"] },
    { "id": "pack", "primary": "pack", "aliases": ["packs", "pac", "pk", "pks"] },
    { "id": "packet", "primary": "packet", "aliases": ["packets", "pkt", "pkts"] },
    { "id": "piece", "primary": "piece", "aliases": ["pieces", "pc", "pcs"] },
    { "id": "tray", "primary": "tray", "aliases": ["trays"] },
    { "id": "pouch", "primary": "pouch", "aliases": ["pouches"] },
    { "id": "jar", "primary": "jar", "aliases": ["jars"] },
    { "id": "tub", "primary": "tub", "aliases": ["tubs"] },
    { "id": "roll", "primary": "roll", "aliases": ["rolls"] },
    { "id": "loaf", "primary": "loaf", "aliases": ["loaves"] },
    { "id": "bunch", "primary": "bunch", "aliases": ["bunches"] },
    { "id": "pair", "primary": "pair", "aliases": ["pairs"] },
    { "id": "bar", "primary": "bar", "aliases": ["bars"] }
  ]
}
