{
  "schemaVersion": 1,
  "locale": "en-IN",
  "version": "2026.08.14.2",
  "fallbacks": [],
  "ui": {
    "languageName": "English (India)",
    "addItem": "Add an item",
    "sortBy": "Sort by",
    "latestAdded": "Latest added",
    "oldestAdded": "Oldest added",
    "itemNameAscending": "Item name A–Z",
    "needsAttentionFirst": "Needs attention first",
    "detail.general.fields": "quantity,unit,packageSize,packageUnit",
    "detail.grocery.fields": "quantity,unit,packageSize,packageUnit",
    "detail.pharmacy.fields": "quantity,unit,packageSize,packageUnit",
    "detail.electronics.fields": "quantity,unit",
    "detail.apparel.fields": "quantity,unit",
    "detail.unknown.fields": "quantity,unit,packageSize,packageUnit",
    "detail.quantity.label": "Quantity",
    "detail.quantity.help": "optional",
    "detail.unit.label": "Unit",
    "detail.unit.help": "optional",
    "detail.packageSize.label": "Package size",
    "detail.packageSize.help": "optional",
    "detail.packageUnit.label": "Package unit",
    "detail.packageUnit.help": "optional",
    "detail.pharmacy.quantity.label": "Buy quantity",
    "detail.pharmacy.unit.label": "Container",
    "detail.pharmacy.packageSize.label": "Net content",
    "detail.pharmacy.packageUnit.label": "Net-content unit",
    "detail.pharmacy.attribute.strength.label": "Strength",
    "detail.pharmacy.attribute.measure:medicine_strength.label": "Strength",
    "detail.pharmacy.attribute.measure:net_content.label": "Net content",
    "detail.grocery.packageSize.label": "Pack size",
    "detail.grocery.packageUnit.label": "Pack unit",
    "detail.electronics.quantity.label": "Buy quantity",
    "detail.electronics.unit.label": "Unit or set",
    "detail.apparel.quantity.label": "Buy quantity",
    "detail.apparel.unit.label": "Unit or pair"
  },
  "items": [
    { "id": "grocery.bread.loaf", "primary": "bread", "aliases": ["loaf"] },
    { "id": "grocery.butter.dairy", "primary": "butter", "aliases": ["dairy butter"] },
    { "id": "grocery.biscuits.plain", "primary": "biscuit", "aliases": ["biscuits", "plain biscuits"] },
    { "id": "grocery.eggs.chicken", "primary": "eggs", "aliases": ["egg", "chicken eggs"] },
      { "id": "grocery.flour.wheat", "primary": "wheat flour", "aliases": ["atta", "whole wheat flour"] },
      { "id": "grocery.milk.dairy", "primary": "milk", "aliases": ["dairy milk"] },
      { "id": "grocery.noodles", "primary": "noodles", "aliases": ["noodle"] },
      { "id": "grocery.onion", "primary": "onions", "aliases": ["onion"] },
    { "id": "grocery.potato", "primary": "potatoes", "aliases": ["potato"] },
    { "id": "grocery.rice.white", "primary": "rice", "aliases": ["white rice"] },
    { "id": "grocery.sugar.white", "primary": "sugar", "aliases": ["white sugar"] },
    { "id": "grocery.tea", "primary": "tea", "aliases": ["chai"] },
    { "id": "grocery.tomato", "primary": "tomatoes", "aliases": ["tomato"] }
  ],
  "units": [
    { "id": "bag", "primary": "bag", "aliases": ["bags"] },
    { "id": "bottle", "primary": "bottle", "aliases": ["bottles"] },
    { "id": "box", "primary": "box", "aliases": ["boxes"] },
    { "id": "can", "primary": "can", "aliases": ["cans"] },
    { "id": "carton", "primary": "carton", "aliases": ["cartons"] },
    { "id": "dozen", "primary": "dozen", "aliases": ["dozens"] },
    { "id": "g", "primary": "g", "aliases": ["gm", "gms", "gram", "grams"] },
    { "id": "kg", "primary": "kg", "aliases": ["kgs", "kilo", "kilos", "kilogram", "kilograms"] },
    { "id": "l", "primary": "l", "aliases": ["liter", "liters", "litre", "litres"] },
    { "id": "ml", "primary": "ml", "aliases": ["milliliter", "milliliters", "millilitre", "millilitres"] },
    { "id": "pack", "primary": "pack", "aliases": ["packs", "pac", "pk", "pks"] },
    { "id": "packet", "primary": "packet", "aliases": ["packets", "pkt", "pkts"] },
    { "id": "piece", "primary": "piece", "aliases": ["pieces", "pc", "pcs"] },
    { "id": "tray", "primary": "tray", "aliases": ["trays"] },
    { "id": "pouch", "primary": "pouch", "aliases": ["pouches"] },
    { "id": "jar", "primary": "jar", "aliases": ["jars"] },
    { "id": "tub", "primary": "tub", "aliases": ["tubs"] },
    { "id": "roll", "primary": "roll", "aliases": ["rolls"] },
    { "id": "loaf", "primary": "loaf", "aliases": ["loaves"] },
    { "id": "bunch", "primary": "bunch", "aliases": ["bunches"] },
    { "id": "pair", "primary": "pair", "aliases": ["pairs"] },
    { "id": "bar", "primary": "bar", "aliases": ["bars"] }
  ]
}
